{
    "border_color": [
        0,
        0,
        127,
        255
    ],
    "border_size": 1,
    "layout": [
        [
            "full_sheet"
        ]
    ],
    "images": {
        "full_sheet": {
            "dimensions": [
                0,
                0,
                600,
                768
            ]
        }
    }
}